id,category,relatedProducts,question,answer,order,isActive,createdAt,updatedAt
1,保固相關,[],"{""zh-TW"": ""如何註冊產品保固？""}","{""zh-TW"": ""請前往「產品保固登錄」頁面,填寫您的個人資訊、產品型號、序號及購買日期等資料,即可完成保固註冊。""}",0,1,2025-11-24 09:41:07,2025-11-24 09:41:07
2,保固相關,[],"{""zh-TW"": ""保固期限是多久？""}","{""zh-TW"": ""Apolnus產品提供2年保固服務,自購買日起計算。部分產品可能有不同的保固期限,詳情請參閱產品說明書。""}",0,1,2025-11-24 09:41:07,2025-11-24 09:41:07
3,維修服務,[],"{""zh-TW"": ""如何提交維修申請？""}","{""zh-TW"": ""請前往「客服中心」頁面,填寫維修申請表單,我們的客服人員會在24小時內與您聯繫。""}",0,1,2025-11-24 09:41:07,2025-11-24 09:41:07
4,維修服務,[],"{""zh-TW"": ""維修需要多久時間？""}","{""zh-TW"": ""一般維修時間為5-7個工作天,實際時間依故障情況而定。我們會盡快為您處理。""}",0,1,2025-11-24 09:41:07,2025-11-24 09:41:07
5,購買相關,[],"{""zh-TW"": ""可以在哪裡購買Apolnus產品？""}","{""zh-TW"": ""您可以透過我們的官方網站、授權經銷商或指定電商平台購買Apolnus產品。""}",0,1,2025-11-24 09:41:07,2025-11-24 09:41:07
6,購買相關,[],"{""zh-TW"": ""產品有哪些付款方式？""}","{""zh-TW"": ""我們接受信用卡、ATM轉帳、貨到付款等多種付款方式。""}",0,1,2025-11-24 09:41:07,2025-11-24 09:41:07
